"DESCRIPTION","DURATION IN MS","NAME","PARENT SUITE","START TIME","STATUS","STOP TIME","SUB SUITE","SUITE","TEST CLASS","TEST METHOD"
"Test om logger kritiske feil","2128","Test om logger kritiske feil Sjekk Feil i Logger[4] ""fpsak""","","2026-01-30","passed","2026-01-30","","no.nav.foreldrepenger.autotest.teknisk.logg.LoggTest","no.nav.foreldrepenger.autotest.teknisk.logg.LoggTest","sjekkFeilILogger"
"Mor søker fødsel og er utvandret. Skal føre til aksjonspunkt angående medlemskap - avslått","6925","Mor søker fødsel er utvandret","","2026-01-30","passed","2026-01-30","","no.nav.foreldrepenger.autotest.fpsak.engangsstonad.Medlemskap","no.nav.foreldrepenger.autotest.fpsak.engangsstonad.Medlemskap","morSøkerFødselErUtvandret"
"Mor søker SVP og FP - revurder SVP, SVP seks uker før termin, FP tre uker før tidligere termin","26385","Mor søker SVP og FP - revurder SVP","","2026-01-30","passed","2026-01-30","","no.nav.foreldrepenger.autotest.fpsak.svangerskapspenger.Førstegangsbehandling","no.nav.foreldrepenger.autotest.fpsak.svangerskapspenger.Førstegangsbehandling","revurder_svp_pga_innvilget_fp"
"Test om lekker sensitive opplysninger","3649","Test om lekker sensitive opplysninger Sjekk sensitiv logg lekkasje[1] ""fpsoknad""","","2026-01-30","passed","2026-01-30","","no.nav.foreldrepenger.autotest.teknisk.logg.LoggTest","no.nav.foreldrepenger.autotest.teknisk.logg.LoggTest","sjekkLoggerForPersonopplysninger"
"","14509","Mor søker fødsel med 2 arbeidsforhold med inntekt over 6G","","2026-01-30","passed","2026-01-30","","no.nav.foreldrepenger.autotest.fpsak.foreldrepenger.Fodsel","no.nav.foreldrepenger.autotest.fpsak.foreldrepenger.Fodsel","morSøkerFødselMedToArbeidsforhold"
"Test om logger kritiske feil","58","Test om logger kritiske feil Sjekk Feil i Logger[14] ""kafka""","","2026-01-30","passed","2026-01-30","","no.nav.foreldrepenger.autotest.teknisk.logg.LoggTest","no.nav.foreldrepenger.autotest.teknisk.logg.LoggTest","sjekkFeilILogger"
"Manuelt opprettet revurdering etter avsluttet behandling med utsendt varsel","29564","Manuelt opprettet revurdering","","2026-01-30","passed","2026-01-30","","no.nav.foreldrepenger.autotest.fpsak.engangsstonad.Revurdering","no.nav.foreldrepenger.autotest.fpsak.engangsstonad.Revurdering","manueltOpprettetRevurderingSendVarsel"
"Bare far har rett (BFHR) og mor mottak uføretrygd. Far har 15 uker uten aktivitetskrav som kan tas ut utover en periode på 46 uker. Far søker uttak og utsettelserList uten at aktivitetskravet er oppfylt. Her vil uttaket bli innvilgetfra de 15 ukene uten aktivitetskrav, mens utsettelsen trekker dager. Far prøver å ta ut foreldrepenger uten aktivitetskravetter uke 46 og for avslag pga manglende stønadsdager igjen på konto.","20911","Bare far har rett. Mor Ufør. Perioder uten at mor er i aktivitet skal trekke fra foreldrepenger uten aktivitetskrav.","","2026-01-30","passed","2026-01-30","","no.nav.foreldrepenger.autotest.fpsak.foreldrepenger.RegresjonPreWLB","no.nav.foreldrepenger.autotest.fpsak.foreldrepenger.RegresjonPreWLB","BFHRMorUføreTrekkerDagerFortløpendeNårVilkårIkkeErOppfylt"
"","9060","Mor søker fødsel med 2 arbeidsforhold i samme organisasjon","","2026-01-30","passed","2026-01-30","","no.nav.foreldrepenger.autotest.fpsak.foreldrepenger.Fodsel","no.nav.foreldrepenger.autotest.fpsak.foreldrepenger.Fodsel","morSøkerFødselMedToArbeidsforholdISammeOrganisasjon"
"Mor søker fødsel aleneomsorg. Annen forelder ikke kjent.","9015","Mor søker fødsel med aleneomsorg","","2026-01-30","passed","2026-01-30","","no.nav.foreldrepenger.autotest.fpsak.foreldrepenger.Fodsel","no.nav.foreldrepenger.autotest.fpsak.foreldrepenger.Fodsel","morSøkerFødselAleneomsorgKunEnHarRett"
"Test om lekker sensitive opplysninger","1","Test om lekker sensitive opplysninger Sjekk sensitiv logg lekkasje[13] ""vtp""","","2026-01-30","passed","2026-01-30","","no.nav.foreldrepenger.autotest.teknisk.logg.LoggTest","no.nav.foreldrepenger.autotest.teknisk.logg.LoggTest","sjekkLoggerForPersonopplysninger"
"Test om logger kritiske feil","166","Test om logger kritiske feil Sjekk Feil i Logger[8] ""fpabakus""","","2026-01-30","passed","2026-01-30","","no.nav.foreldrepenger.autotest.teknisk.logg.LoggTest","no.nav.foreldrepenger.autotest.teknisk.logg.LoggTest","sjekkFeilILogger"
"Mor søker fødsel. Har ikke arbeidsforhold i AAREG, men det blir sendt inn en innteksmelding. Saksbehandler legger til arbeidsforhold basert på motatt inntektsmelding","14051","Mor søker fødsel, men har ikke arbeidsforhold i AAREG, sender inntektsmelding","","2026-01-30","passed","2026-01-30","","no.nav.foreldrepenger.autotest.fpsak.foreldrepenger.ArbeidsforholdVarianter","no.nav.foreldrepenger.autotest.fpsak.foreldrepenger.ArbeidsforholdVarianter","utenArbeidsforholdMenMedInntektsmelding"
"Mor søker adopsjon - avvist - barn er over 15 år og blir dermed avlått","5956","Mor søker adopsjon - avvist - barn er over 15 år","","2026-01-30","passed","2026-01-30","","no.nav.foreldrepenger.autotest.fpsak.engangsstonad.Adopsjon","no.nav.foreldrepenger.autotest.fpsak.engangsstonad.Adopsjon","morSøkerAdopsjonAvvist"
"Mor med ett arbeidsforhold sender inn inntektsmelding før søknad. Forventer at vedtak bli fattet og det blir bare opprettet en behandling","0","Mor søker med ett arbeidsforhold. Inntektmelding innsendt før søknad","","2026-01-30","skipped","2026-01-30","","no.nav.foreldrepenger.autotest.fpsak.foreldrepenger.Termin","no.nav.foreldrepenger.autotest.fpsak.foreldrepenger.Termin","MorSøkerMedEttArbeidsforholdInntektsmeldingFørSøknad"
"Test om logger kritiske feil","3","Test om logger kritiske feil Sjekk Feil i Logger[16] ""postgres""","","2026-01-30","passed","2026-01-30","","no.nav.foreldrepenger.autotest.teknisk.logg.LoggTest","no.nav.foreldrepenger.autotest.teknisk.logg.LoggTest","sjekkFeilILogger"
"","14920","Mor med for sent refusjonskrav.","","2026-01-30","passed","2026-01-30","","no.nav.foreldrepenger.autotest.fpsak.foreldrepenger.BeregningVerdikjede","no.nav.foreldrepenger.autotest.fpsak.foreldrepenger.BeregningVerdikjede","morFødselForSentRefusjonskrav"
"","10789","Mor søker fødsel med full AAP og et arbeidsforhold som tilkommer etter skjæringstidspunktet","","2026-01-30","passed","2026-01-30","","no.nav.foreldrepenger.autotest.fpsak.foreldrepenger.BeregningVerdikjede","no.nav.foreldrepenger.autotest.fpsak.foreldrepenger.BeregningVerdikjede","morSøkerFødselMedFullAAPOgArbeidsforhold"
"Test om lekker sensitive opplysninger","3334","Test om lekker sensitive opplysninger Sjekk sensitiv logg lekkasje[7] ""fpoppdrag""","","2026-01-30","passed","2026-01-30","","no.nav.foreldrepenger.autotest.teknisk.logg.LoggTest","no.nav.foreldrepenger.autotest.teknisk.logg.LoggTest","sjekkLoggerForPersonopplysninger"
"Mor søker termin uten periode for foreldrepenger før fødsel. Skjæringstidspunkt skal være 3 uker før termindato.","10133","Mor søker termin uten FPFF","","2026-01-30","passed","2026-01-30","","no.nav.foreldrepenger.autotest.fpsak.foreldrepenger.Termin","no.nav.foreldrepenger.autotest.fpsak.foreldrepenger.Termin","morSokerTerminUtenFPFFperiode"
"Test om logger kritiske feil","3","Test om logger kritiske feil Sjekk Feil i Logger[10] ""fptilgang""","","2026-01-30","passed","2026-01-30","","no.nav.foreldrepenger.autotest.teknisk.logg.LoggTest","no.nav.foreldrepenger.autotest.teknisk.logg.LoggTest","sjekkFeilILogger"
"Test om logger kritiske feil","133","Test om logger kritiske feil Sjekk Feil i Logger[6] ""fpkalkulus""","","2026-01-30","passed","2026-01-30","","no.nav.foreldrepenger.autotest.teknisk.logg.LoggTest","no.nav.foreldrepenger.autotest.teknisk.logg.LoggTest","sjekkFeilILogger"
"Sender inn søknad mor. Sender inn søknad far uten overlapp. Sender inn endringssøknad mor som er lik førstegangsbehandlingen. Verifiserer at det ikke blir berørt sak på far.","31861","Koblet sak endringssøknad ingen endring","","2026-01-30","passed","2026-01-30","","no.nav.foreldrepenger.autotest.fpsak.foreldrepenger.MorOgFarSammen","no.nav.foreldrepenger.autotest.fpsak.foreldrepenger.MorOgFarSammen","kobletSakIngenEndring"
"","12920","Far søker fødsel med aleneomsorg som bekreftes at han har (mor forsvunnet)","","2026-01-30","passed","2026-01-30","","no.nav.foreldrepenger.autotest.fpsak.foreldrepenger.Fodsel","no.nav.foreldrepenger.autotest.fpsak.foreldrepenger.Fodsel","farSøkerFødselAleneomsorgMenErGiftOgBorMedAnnenpart"
"Test om logger kritiske feil","359","Test om logger kritiske feil Sjekk Feil i Logger[2] ""fpmottak""","","2026-01-30","passed","2026-01-30","","no.nav.foreldrepenger.autotest.teknisk.logg.LoggTest","no.nav.foreldrepenger.autotest.teknisk.logg.LoggTest","sjekkFeilILogger"
"Mor søker uregistrert fødsel før det har gått 1 uke - skal sette behandling på vent","4400","Mor søker uregistrert fødsel før det har gått 1 uke","","2026-01-30","passed","2026-01-30","","no.nav.foreldrepenger.autotest.fpsak.foreldrepenger.Fodsel","no.nav.foreldrepenger.autotest.fpsak.foreldrepenger.Fodsel","morSøkerUregistrertEtterFør2Uker"
"Mor søker fødsel - godkjent happy case","3157","Mor søker fødsel - godkjent","","2026-01-30","passed","2026-01-30","","no.nav.foreldrepenger.autotest.fpsak.engangsstonad.Fodsel","no.nav.foreldrepenger.autotest.fpsak.engangsstonad.Fodsel","morSøkerFødselGodkjent"
"Test om lekker sensitive opplysninger","6787","Test om lekker sensitive opplysninger Sjekk sensitiv logg lekkasje[9] ""fprisk""","","2026-01-30","passed","2026-01-30","","no.nav.foreldrepenger.autotest.teknisk.logg.LoggTest","no.nav.foreldrepenger.autotest.teknisk.logg.LoggTest","sjekkLoggerForPersonopplysninger"
"","11930","Mor søker fødsel med 1 arbeidsforhold og avvik i beregning","","2026-01-30","passed","2026-01-30","","no.nav.foreldrepenger.autotest.fpsak.foreldrepenger.Fodsel","no.nav.foreldrepenger.autotest.fpsak.foreldrepenger.Fodsel","morSøkerFødselMedEttArbeidsforhold_AvvikIBeregning"
"Test om lekker sensitive opplysninger","3","Test om lekker sensitive opplysninger Sjekk sensitiv logg lekkasje[19] ""fpcache""","","2026-01-30","passed","2026-01-30","","no.nav.foreldrepenger.autotest.teknisk.logg.LoggTest","no.nav.foreldrepenger.autotest.teknisk.logg.LoggTest","sjekkLoggerForPersonopplysninger"
"Mor endringssøknad med aksjonspunkt i uttak. Søker for lang mødrekvote for å få aksjonspunkt.Saksbehandler avslår. Mor har også arbeid med arbeidsforholdId i inntektsmelding","22562","Mor endringssøknad med aksjonspunkt i uttak","","2026-01-30","passed","2026-01-30","","no.nav.foreldrepenger.autotest.fpsak.foreldrepenger.SammenhengendeUttak","no.nav.foreldrepenger.autotest.fpsak.foreldrepenger.SammenhengendeUttak","endringssøknad_med_aksjonspunkt_i_uttak"
"Ikke få avslåg på innvilget perioder pga søknadsfrist.","24031","Ikke få avslåg på innvilget perioder pga søknadsfrist","","2026-01-30","passed","2026-01-30","","no.nav.foreldrepenger.autotest.fpsak.foreldrepenger.Revurdering","no.nav.foreldrepenger.autotest.fpsak.foreldrepenger.Revurdering","ikke_avslag_pa_innvilget_perioder_pga_søknadsfrist_i_revurdering"
"Scenario 2: Mor har tatt ut mindre enn minsterett på barn 1 (f.eks. 4 uker igjen av minsteretten).Far tar ut ifm fødsel og 10 uker av fedrekvoten som strekker seg over uke 40 (termin for barn 2).Mor søker termin på barn 2 (40 uker etter barn 1) som førere til revurdering på far.Far sin sak revurderes og avslår uker som strekker seg forbi startdato barn 2 og som ikke er minstrett.Mor søker endring på barn 1 om å ta 8 uker (bare 4 uker gjenstår av minstrett) etter de 6 første ukene for barn 2. Delvis innvilget","59603","Mor og far beholder minsteretten ved to tette og kan ta ut denne etter fødsel av siste barn","","2026-01-30","passed","2026-01-30","","no.nav.foreldrepenger.autotest.fpsak.foreldrepenger.ToTetteOgMinsterettTester","no.nav.foreldrepenger.autotest.fpsak.foreldrepenger.ToTetteOgMinsterettTester","mor_og_far_beholder_minsteretten_ved_to_tette_og_kan_ta_ut_denne_etter_fødel_av_siste_barn"
"Mor søker fødsel - avvist fordi dokumentasjon mangler og barn er ikke registrert i freg","5959","Mor søker fødsel - avvist","","2026-01-30","passed","2026-01-30","","no.nav.foreldrepenger.autotest.fpsak.engangsstonad.Fodsel","no.nav.foreldrepenger.autotest.fpsak.engangsstonad.Fodsel","morSøkerFødselAvvist"
"","11757","Mor søker fødsel med full AAP og et arbeidsforhold.","","2026-01-30","passed","2026-01-30","","no.nav.foreldrepenger.autotest.fpsak.foreldrepenger.BeregningVerdikjede","no.nav.foreldrepenger.autotest.fpsak.foreldrepenger.BeregningVerdikjede","morSøkerFødselMedFullAAPOgArbeidsforholdSomErAktivtPåStp"
"Mor søker fødsel med mange utsettelseperioder. Hensikten er å sjekke at alle årsaker fungerer.Kun arbeid (og ferie) skal oppgis i IM. Verifiserer på 0 trekkdager for perioder med utsettelserList. Kun perioder som krever dokumentasjon skal bli manuelt behandlet i fakta om uttak. Ingen AP i uttak.","14295","Utsettelse av forskjellige årsaker","","2026-01-30","passed","2026-01-30","","no.nav.foreldrepenger.autotest.fpsak.foreldrepenger.SammenhengendeUttak","no.nav.foreldrepenger.autotest.fpsak.foreldrepenger.SammenhengendeUttak","utsettelse_med_avvik"
"Test om lekker sensitive opplysninger","40152","Test om lekker sensitive opplysninger Sjekk sensitiv logg lekkasje[4] ""fpsak""","","2026-01-30","passed","2026-01-30","","no.nav.foreldrepenger.autotest.teknisk.logg.LoggTest","no.nav.foreldrepenger.autotest.teknisk.logg.LoggTest","sjekkLoggerForPersonopplysninger"
"Mor søker uregistrert fødsel mindre enn 14 dager etter fødsel. Behandlingen skal bli satt på vent","2844","Mor søker uregistrert fødsel mindre enn 14 dager etter fødsel","","2026-01-30","passed","2026-01-30","","no.nav.foreldrepenger.autotest.fpsak.engangsstonad.Fodsel","no.nav.foreldrepenger.autotest.fpsak.engangsstonad.Fodsel","morSøkerUregistrertFødselMindreEnn14DagerEtter"
"Mor fødsel med frilans som eneste inntekt. Oppgir ikke frilans i søknaden","7474","Mor fødsel med frilans som eneste inntekt","","2026-01-30","passed","2026-01-30","","no.nav.foreldrepenger.autotest.fpsak.foreldrepenger.BeregningVerdikjede","no.nav.foreldrepenger.autotest.fpsak.foreldrepenger.BeregningVerdikjede","morSøkerFødselMedEttArbeidsforholdOgFrilans_VurderOpptjening_VurderFaktaOmBeregning_AvvikIBeregning"
"Setter behandling på vent og gjennoptar og henlegger","6070","Setter behandling på vent og gjennoptar og henlegger","","2026-01-30","passed","2026-01-30","","no.nav.foreldrepenger.autotest.fpsak.engangsstonad.Termin","no.nav.foreldrepenger.autotest.fpsak.engangsstonad.Termin","settBehandlingPåVentOgGjenopptaOgHenlegg"
"Far søker adopsjon - godkjent happy case","9907","Far søker adopsjon - godkjent","","2026-01-30","passed","2026-01-30","","no.nav.foreldrepenger.autotest.fpsak.engangsstonad.Adopsjon","no.nav.foreldrepenger.autotest.fpsak.engangsstonad.Adopsjon","farSøkerAdopsjonGodkjent"
"Test om lekker sensitive opplysninger","11294","Test om lekker sensitive opplysninger Sjekk sensitiv logg lekkasje[3] ""fpoversikt""","","2026-01-30","passed","2026-01-30","","no.nav.foreldrepenger.autotest.teknisk.logg.LoggTest","no.nav.foreldrepenger.autotest.teknisk.logg.LoggTest","sjekkLoggerForPersonopplysninger"
"Test om logger kritiske feil","5","Test om logger kritiske feil Sjekk Feil i Logger[13] ""vtp""","","2026-01-30","passed","2026-01-30","","no.nav.foreldrepenger.autotest.teknisk.logg.LoggTest","no.nav.foreldrepenger.autotest.teknisk.logg.LoggTest","sjekkFeilILogger"
"Mor søker og får innvilget. Far søker og får innvilget rundt fødsel. Far søker utsatt oppstart og blir innvilget uten berørt behandling hos mor.","27102","Koblet sak. Far utsetter oppstart rundt fødsel","","2026-01-30","passed","2026-01-30","","no.nav.foreldrepenger.autotest.fpsak.foreldrepenger.MorOgFarSammen","no.nav.foreldrepenger.autotest.fpsak.foreldrepenger.MorOgFarSammen","farUtsetterOppstartRundtFødsel"
"Far søker. Blir satt på vent pga for tidlig søknad. Mor søker og får innvilget. Oppretter manuell revurdering på mor.","21084","Koblet sak mor søker etter far og sniker i køen","","2026-01-30","passed","2026-01-30","","no.nav.foreldrepenger.autotest.fpsak.foreldrepenger.MorOgFarSammen","no.nav.foreldrepenger.autotest.fpsak.foreldrepenger.MorOgFarSammen","kobletSakMorSøkerEtterFar"
"","12252","Far søker fødsel med 1 arbeidsforhold","","2026-01-30","passed","2026-01-30","","no.nav.foreldrepenger.autotest.fpsak.foreldrepenger.Fodsel","no.nav.foreldrepenger.autotest.fpsak.foreldrepenger.Fodsel","farSøkerFødselMedEttArbeidsforhold"
"Fortsatt få avslag på avslåtte perioder pga søknadsfrist i neste revurdering. Bruker papirsøknad for å kunne sette mottatt dato tilbake i tid","23729","Fortsatt få avslag på avslåtte perioder pga søknadsfrist i neste revurdering","","2026-01-30","passed","2026-01-30","","no.nav.foreldrepenger.autotest.fpsak.foreldrepenger.Revurdering","no.nav.foreldrepenger.autotest.fpsak.foreldrepenger.Revurdering","fortsatt_tape_avslåtte_perioder_pga_søknadsfrist_i_revurdering"
"Behandle innsyn for mor - godkjent happy case","9729","Behandle innsyn for mor - godkjent","","2026-01-30","passed","2026-01-30","","no.nav.foreldrepenger.autotest.fpsak.engangsstonad.Innsyn","no.nav.foreldrepenger.autotest.fpsak.engangsstonad.Innsyn","behandleInnsynMorGodkjent"
"Mor søker med personstatus uregistrert, får askjonspunkt så hennlegges","25235","Mor søker med personstatus uregistrert","","2026-01-30","passed","2026-01-30","","no.nav.foreldrepenger.autotest.fpsak.engangsstonad.Medlemskap","no.nav.foreldrepenger.autotest.fpsak.engangsstonad.Medlemskap","morSøkerFødselUregistrert"
"Sender inn klage på førstegangsbehandling. Bekrefter medhold i Ugunst hos NFP. Beslutter og avslutter.","20900","Klage med Medhold Ugunst NFP","","2026-01-30","passed","2026-01-30","","no.nav.foreldrepenger.autotest.fpsak.foreldrepenger.Klage","no.nav.foreldrepenger.autotest.fpsak.foreldrepenger.Klage","klageMedholUgunstNFP"
"Mor søker, får aksjonspunkt slik at behandling stopper opp. Far sender deretter søknad med uttak ifm fødsel og blir satt på vent pga manglende inntektsmelding.Behandler ferdig mor sin søknad (positivt vedtak). Behandler deretter far sin søknad (positivt og automatisk vedtak). Ingen overlapp, med unntak av de to ukene ifm med fødsel. Verifiserer at sakene er koblet og at det ikke opprettes revurdering berørt sak.","22625","Mor og far koblet sak, kant til kant","","2026-01-30","passed","2026-01-30","","no.nav.foreldrepenger.autotest.fpsak.foreldrepenger.MorOgFarSammen","no.nav.foreldrepenger.autotest.fpsak.foreldrepenger.MorOgFarSammen","morOgFar_fødsel_ettArbeidsforholdHver_kobletsak_kantTilKant"
"Test om logger kritiske feil","208","Test om logger kritiske feil Sjekk Feil i Logger[11] ""fpformidling""","","2026-01-30","passed","2026-01-30","","no.nav.foreldrepenger.autotest.teknisk.logg.LoggTest","no.nav.foreldrepenger.autotest.teknisk.logg.LoggTest","sjekkFeilILogger"
"Førstegangsbehandling til positivt vedtak. Endringssøknad med utsettelserList fra bruker. Vedtak fortsatt løpende.","17743","Endringssøknad med utsettelserList","","2026-01-30","passed","2026-01-30","","no.nav.foreldrepenger.autotest.fpsak.foreldrepenger.SammenhengendeUttak","no.nav.foreldrepenger.autotest.fpsak.foreldrepenger.SammenhengendeUttak","endringssøknadMedUtsettelse"
"Behandle innsyn for mor - avvist ved vurdering","29798","Behandle innsyn for mor - avvist","","2026-01-30","passed","2026-01-30","","no.nav.foreldrepenger.autotest.fpsak.engangsstonad.Innsyn","no.nav.foreldrepenger.autotest.fpsak.engangsstonad.Innsyn","behandleInnsynMorAvvist"
"Uten inntektsmelding, med lønnsendring de siste 3 månedene","6623","Uten inntektsmelding, med lønnsendring de siste 3 månedene","","2026-01-30","passed","2026-01-30","","no.nav.foreldrepenger.autotest.fpsak.foreldrepenger.BeregningVerdikjede","no.nav.foreldrepenger.autotest.fpsak.foreldrepenger.BeregningVerdikjede","vurder_mottar_ytelse_vurder_lonnsendring"
"Mor søker termin 25 dager etter fødsel - Får aksjonpunkt om manglende fødsel - godkjent","10640","Mor søker termin 25 dager etter fødsel","","2026-01-30","passed","2026-01-30","","no.nav.foreldrepenger.autotest.fpsak.engangsstonad.Termin","no.nav.foreldrepenger.autotest.fpsak.engangsstonad.Termin","morSøkerTermin25DagerTilbakeITid"
"Utsettelser og gradering fra førstegangsbehandling skal ikke gå til manuell behandling hvis innenfor søknadsfrist.Førstegangsbehandling avslutter med utsettelserList. Søker sender inn endringssøknad hvor en tar ut 1 uke etter utsettelsen.","27174","Utsettelser og gradering fra førstegangsbehandling skal ikke gå til manuell behandling","","2026-01-30","passed","2026-01-30","","no.nav.foreldrepenger.autotest.fpsak.foreldrepenger.SammenhengendeUttak","no.nav.foreldrepenger.autotest.fpsak.foreldrepenger.SammenhengendeUttak","utsettelser_og_gradering_fra_førstegangsbehandling_skal_ikke_gå_til_manuell_behandling_ved_endringssøknad"
"Test om logger kritiske feil","83","Test om logger kritiske feil Sjekk Feil i Logger[7] ""fpoppdrag""","","2026-01-30","passed","2026-01-30","","no.nav.foreldrepenger.autotest.teknisk.logg.LoggTest","no.nav.foreldrepenger.autotest.teknisk.logg.LoggTest","sjekkFeilILogger"
"Test om logger kritiske feil","40","Test om logger kritiske feil Sjekk Feil i Logger[18] ""fpdokgen""","","2026-01-30","passed","2026-01-30","","no.nav.foreldrepenger.autotest.teknisk.logg.LoggTest","no.nav.foreldrepenger.autotest.teknisk.logg.LoggTest","sjekkFeilILogger"
"Test om lekker sensitive opplysninger","11146","Test om lekker sensitive opplysninger Sjekk sensitiv logg lekkasje[11] ""fpformidling""","","2026-01-30","passed","2026-01-30","","no.nav.foreldrepenger.autotest.teknisk.logg.LoggTest","no.nav.foreldrepenger.autotest.teknisk.logg.LoggTest","sjekkLoggerForPersonopplysninger"
"Mor søker fødsel med ett arbeidsforhold og frilans. Vurder opptjening. Vurder fakta om beregning. Avvik i beregning","13758","Mor fødsel med arbeidsforhold og frilans. Vurderer opptjening og beregning. Finner avvik","","2026-01-30","passed","2026-01-30","","no.nav.foreldrepenger.autotest.fpsak.foreldrepenger.Fodsel","no.nav.foreldrepenger.autotest.fpsak.foreldrepenger.Fodsel","morSøkerFødselMedEttArbeidsforholdOgFrilans_VurderOpptjening_VurderFaktaOmBeregning_AvvikIBeregning"
"Mor søker SVP med to arbeidsforhold, fire uke før termin, hel tilrettelegging","16234","Mor søker SVP med to arbeidsforhold - hel tilrettelegging","","2026-01-30","passed","2026-01-30","","no.nav.foreldrepenger.autotest.fpsak.svangerskapspenger.Førstegangsbehandling","no.nav.foreldrepenger.autotest.fpsak.svangerskapspenger.Førstegangsbehandling","morSøkerSvp_HelTilrettelegging_FireUkerFørTermin_ToArbeidsforholdFraUlikeVirksomheter"
"","20886","Mor søker fødsel med 1 arbeidsforhold, Papirsøkand","","2026-01-30","passed","2026-01-30","","no.nav.foreldrepenger.autotest.fpsak.foreldrepenger.Fodsel","no.nav.foreldrepenger.autotest.fpsak.foreldrepenger.Fodsel","morSøkerFødselMedEttArbeidsforhold_papirsøknad"
"Mor søker SVP med ett arbeidsforhold - halv og så endring til ingen tilrettelegging. Full refusjon","44239","Mor søker SVP med ett arbeidsforhold - halv og så endring til ingen tilrettelegging. Full refusjon","","2026-01-30","passed","2026-01-30","","no.nav.foreldrepenger.autotest.fpsak.svangerskapspenger.Førstegangsbehandling","no.nav.foreldrepenger.autotest.fpsak.svangerskapspenger.Førstegangsbehandling","mor_søker_svp_ett_arbeidsforhold_endrer_ingen_tilrettelegging"
"Mor søker fødsel med flere barn - happy case flere barn","7850","Mor søker fødsel med flere barn","","2026-01-30","passed","2026-01-30","","no.nav.foreldrepenger.autotest.fpsak.engangsstonad.Fodsel","no.nav.foreldrepenger.autotest.fpsak.engangsstonad.Fodsel","morSøkerFødselFlereBarn"
"Førstegangsbehandling til positivt vedtak. Endringssøknad med gradering fra bruker. Vedtak fortsatt løpende.","14185","Endringssøknad med gradering","","2026-01-30","passed","2026-01-30","","no.nav.foreldrepenger.autotest.fpsak.foreldrepenger.Revurdering","no.nav.foreldrepenger.autotest.fpsak.foreldrepenger.Revurdering","endringssøknadMedGradering"
"Mor med kun ytelse på skjæringstidspunktet og dagpenger i opptjeningsperioden","12262","Mor med kun ytelse på skjæringstidspunktet og dagpenger i opptjeningsperioden","","2026-01-30","passed","2026-01-30","","no.nav.foreldrepenger.autotest.fpsak.foreldrepenger.BeregningVerdikjede","no.nav.foreldrepenger.autotest.fpsak.foreldrepenger.BeregningVerdikjede","kun_ytelse_med_vurdering_av_besteberegning"
"Test om logger kritiske feil","127","Test om logger kritiske feil Sjekk Feil i Logger[5] ""fptilbake""","","2026-01-30","passed","2026-01-30","","no.nav.foreldrepenger.autotest.teknisk.logg.LoggTest","no.nav.foreldrepenger.autotest.teknisk.logg.LoggTest","sjekkFeilILogger"
"Test om lekker sensitive opplysninger","8709","Test om lekker sensitive opplysninger Sjekk sensitiv logg lekkasje[5] ""fptilbake""","","2026-01-30","passed","2026-01-30","","no.nav.foreldrepenger.autotest.teknisk.logg.LoggTest","no.nav.foreldrepenger.autotest.teknisk.logg.LoggTest","sjekkLoggerForPersonopplysninger"
"Far søker rundt fødsel hvor han oppgir at mor er trenger hjelp. Saksbehanlder velger at sykdom ikke er dokumentertog avslå perioden ifm fødel. Resten skal innvilges automatisk.","18418","Far søker rundt fødsel, saksbehandler finner ut at mor ikke er syk eller innlagt, vil føre til avslag i perioden","","2026-01-30","passed","2026-01-30","","no.nav.foreldrepenger.autotest.fpsak.foreldrepenger.RegresjonPreWLB","no.nav.foreldrepenger.autotest.fpsak.foreldrepenger.RegresjonPreWLB","farSøkerImfFødselMenMorErIkkeSykEllerInnlagt"
